{"schema_version":"1.0","run_id":"RUN-2026-03-24-001","step_id":"00","step_name":"REQUEST_NORMALIZATION","status":"complete","input_file":"request.md","input_checksum":"sha256:0000000000000000000000000000000000000000000000000000000000000000","created_at":"2026-03-24T18:00:00Z","actor":{"mode":"agent","actor_id":"claude-opus-4-6"},"objective":{"task_name":"Fix All Android Bugs","task_type":"bug_fix","success_definition":"All 5 bugs fixed in Android app"},"payload":{"request_text":"Fix 5 Android bugs: WorkOS auth, logo, EULA, settings-auth link, logo visibility","goal":"Fix all reported bugs in the Android app","constraints":["Android only, not iOS","Must use correct TG logo PNG","EULA must be word-for-word from legal text"],"desired_outputs":["Fixed Kotlin source files","Logo asset added"],"priority":"high","deadline":"","stakeholders":["developer"],"task_class":"bug_fix"},"artifacts":[],"metrics":{"ambiguity_count":0,"missing_field_count":0,"normalization_confidence":0.95},"hil":{"required":false,"status":"not_required"},"decision":{"result":"pass","next_step":"01_intake.json"},"trace":{"assumptions":[],"risks":[],"changes":[],"lineage":[]}}
